{"context_package_id":"context-demo-step0","schema_version":"1.0.0","tenant_id":"tenant-demo","project_id":"project-demo","run_id":"run-demo-step0","step_id":"0","logical_session_id":"logical-session-demo-0001","logical_session_revision":1,"trigger":"initial_step","target_revision":1,"prompt":{"prompt_id":"heartweb.step.0","prompt_version":"1.5.0","prompt_path":"prompts/0-kickoff.xml.md","prompt_sha256":"e8b85ebdc3cf95864cd2351d3a5c20516c298ea87935acb1b180b55185197248"},"project_context":{"binding_mode":"project_intake","source_id":"intake-demo-0001","revision":1,"logical_ref":"runtime:intake/intake-demo-0001","content_sha256":"bbbbbbbbbbbbbbbbbbbbbbbbbbbbbbbbbbbbbbbbbbbbbbbbbbbbbbbbbbbbbbbb"},"worker_profile_ref":{"worker_profile_id":"worker-profile-demo","profile_version":"1.0.0","profile_sha256":"cccccccccccccccccccccccccccccccccccccccccccccccccccccccccccccccc"},"output_contracts":[{"contract_id":"https://heartweb.example/schema/manifest.schema.json","contract_version":"1.0.0","contract_path":"standards/manifest.schema.json","contract_sha256":"21f818797007d35adf47996d45ac3de2f666de71d0b5c937cc69f0755cd77c2e"}],"sources":[{"include_order":1,"source_kind":"project_intake","source_id":"intake-demo-0001","tenant_id":"tenant-demo","project_id":"project-demo","revision":1,"logical_ref":"runtime:intake/intake-demo-0001","content_sha256":"bbbbbbbbbbbbbbbbbbbbbbbbbbbbbbbbbbbbbbbbbbbbbbbbbbbbbbbbbbbbbbbb","source_status":"active","trust_level":"trusted"}],"source_manifest_sha256":"eeeeeeeeeeeeeeeeeeeeeeeeeeeeeeeeeeeeeeeeeeeeeeeeeeeeeeeeeeeeeeee","package_sha256":"ffffffffffffffffffffffffffffffffffffffffffffffffffffffffffffffff","builder_provenance":{"builder_version":"1.0.0","created_at":"2026-08-20T00:00:00Z","created_by":"actor-demo"}}
