{"builder_provenance":{"builder_version":"1.0.0","created_at":"2026-08-20T00:00:00Z","created_by":"actor-demo"},"context_package_id":"context-demo-step1c","logical_session_id":"logical-session-demo-0002","logical_session_revision":2,"output_contracts":[{"contract_id":"https://heartweb.example/schema/outputs/step-1c-design-system.schema.json","contract_path":"standards/outputs/step-1c-design-system.schema.json","contract_sha256":"51a6c601505000e346d79c258910ca705876ec756fefb1cc26d6e5ea507cc7d4","contract_version":"2.0.0"},{"contract_id":"https://heartweb.example/schema/outputs/step-1c-template.schema.json","contract_path":"standards/outputs/step-1c-template.schema.json","contract_sha256":"705e3bd944f62256ddbad4450ec857dc01607359f6493c2604fa748877ce4056","contract_version":"2.0.0"}],"package_sha256":"8a0267c3f3382775a9ccaeb51e6ee37d1102209b22ae3bbad81f71b3c699a80a","project_context":{"binding_mode":"project_v2","content_sha256":"bbbbbbbbbbbbbbbbbbbbbbbbbbbbbbbbbbbbbbbbbbbbbbbbbbbbbbbbbbbbbbbb","logical_ref":"runtime:project/project-v2-demo-0001","revision":1,"source_id":"project-v2-demo-0001"},"project_id":"project-demo","prompt":{"prompt_id":"heartweb.step.1c","prompt_path":"prompts/1c-pillar-template.xml.md","prompt_sha256":"7b12fac9cec125aa1932242a9a0d0b1fdf580cccd7faefa855a5c4c3bc1eefdb","prompt_version":"2.1.0"},"run_id":"run-demo-step1c","schema_version":"1.0.0","source_manifest_sha256":"eeeeeeeeeeeeeeeeeeeeeeeeeeeeeeeeeeeeeeeeeeeeeeeeeeeeeeeeeeeeeeee","sources":[{"content_sha256":"bbbbbbbbbbbbbbbbbbbbbbbbbbbbbbbbbbbbbbbbbbbbbbbbbbbbbbbbbbbbbbbb","include_order":1,"logical_ref":"runtime:project/project-v2-demo-0001","project_id":"project-demo","revision":1,"source_id":"project-v2-demo-0001","source_kind":"project_v2","source_status":"released","tenant_id":"tenant-demo","trust_level":"trusted"},{"content_sha256":"ffffffffffffffffffffffffffffffffffffffffffffffffffffffffffffffff","include_order":2,"logical_ref":"runtime:artifact/artifact-step1b-demo","project_id":"project-demo","revision":1,"source_id":"artifact-step1b-demo","source_kind":"released_predecessor","source_status":"released","tenant_id":"tenant-demo","trust_level":"trusted"}],"step_id":"1c","target_revision":1,"tenant_id":"tenant-demo","trigger":"next_step","worker_profile_ref":{"profile_sha256":"cccccccccccccccccccccccccccccccccccccccccccccccccccccccccccccccc","profile_version":"1.0.0","worker_profile_id":"worker-profile-demo"}}
