{"builder_provenance":{"builder_version":"1.0.0","created_at":"2026-08-20T00:00:00Z","created_by":"actor-demo"},"context_package_id":"context-demo-revision","logical_session_id":"logical-session-demo-0002","logical_session_revision":2,"output_contracts":[{"contract_id":"https://heartweb.example/schema/outputs/step-4a-briefing.schema.json","contract_path":"standards/outputs/step-4a-briefing.schema.json","contract_sha256":"dc9d7731d70f5bee4f0e4b99ce292c2dc1991767f2f413e043e80552b3d14093","contract_version":"2.0.0"},{"contract_id":"https://heartweb.example/schema/outputs/claim-ledger.schema.json","contract_path":"standards/outputs/claim-ledger.schema.json","contract_sha256":"945f23deec09ec8d371365eae4d8a4fef37f320f45e161c0c048d758f26ff990","contract_version":"2.0.0"}],"package_sha256":"095a59219a2099ede2eb11a0fadd3eaeb9d5d49975de0a6dcad3d016bd782eb8","project_context":{"binding_mode":"project_v2","content_sha256":"bbbbbbbbbbbbbbbbbbbbbbbbbbbbbbbbbbbbbbbbbbbbbbbbbbbbbbbbbbbbbbbb","logical_ref":"runtime:project/project-v2-demo-0001","revision":1,"source_id":"project-v2-demo-0001"},"project_id":"project-demo","prompt":{"prompt_id":"heartweb.step.4a","prompt_path":"prompts/4a-content-briefing-und-schema.xml.md","prompt_sha256":"f97bcd37990e8207916ff88c6ce4b0980aeefeecbfb77eeae1200a4bd5dec3f9","prompt_version":"2.2.0"},"revision_context":{"expected_new_revision":3,"finding_logical_ref":"runtime:quality-gate/quality-gate-demo","rejected_artifact_revision":2,"revision_request_id":"revision-request-demo"},"run_id":"run-demo-revision","schema_version":"1.0.0","source_manifest_sha256":"dddddddddddddddddddddddddddddddddddddddddddddddddddddddddddddddd","sources":[{"content_sha256":"bbbbbbbbbbbbbbbbbbbbbbbbbbbbbbbbbbbbbbbbbbbbbbbbbbbbbbbbbbbbbbbb","include_order":1,"logical_ref":"runtime:project/project-v2-demo-0001","project_id":"project-demo","revision":1,"source_id":"project-v2-demo-0001","source_kind":"project_v2","source_status":"released","tenant_id":"tenant-demo","trust_level":"trusted"},{"content_sha256":"dddddddddddddddddddddddddddddddddddddddddddddddddddddddddddddddd","include_order":2,"logical_ref":"runtime:artifact/artifact-step3-demo","project_id":"project-demo","revision":1,"source_id":"artifact-step3-demo","source_kind":"released_predecessor","source_status":"released","tenant_id":"tenant-demo","trust_level":"trusted"},{"content_sha256":"eeeeeeeeeeeeeeeeeeeeeeeeeeeeeeeeeeeeeeeeeeeeeeeeeeeeeeeeeeeeeeee","include_order":3,"logical_ref":"runtime:artifact/artifact-step4a-demo","project_id":"project-demo","revision":2,"source_id":"artifact-step4a-demo","source_kind":"rejected_artifact","source_status":"rejected","tenant_id":"tenant-demo","trust_level":"trusted"},{"content_sha256":"ffffffffffffffffffffffffffffffffffffffffffffffffffffffffffffffff","include_order":4,"logical_ref":"operator:revision/revision-request-demo","project_id":"project-demo","revision":2,"source_id":"revision-request-demo","source_kind":"revision_request","source_status":"active","tenant_id":"tenant-demo","trust_level":"trusted"},{"content_sha256":"aaaaaaaaaaaaaaaaaaaaaaaaaaaaaaaaaaaaaaaaaaaaaaaaaaaaaaaaaaaaaaaa","include_order":5,"logical_ref":"operator:instruction/instruction-demo","project_id":"project-demo","revision":2,"source_id":"instruction-demo","source_kind":"operator_instruction","source_status":"active","tenant_id":"tenant-demo","trust_level":"operator_asserted"},{"content_sha256":"cccccccccccccccccccccccccccccccccccccccccccccccccccccccccccccccc","include_order":6,"logical_ref":"runtime:quality-gate/quality-gate-demo","project_id":"project-demo","revision":2,"source_id":"quality-gate-demo","source_kind":"quality_gate_run","source_status":"active","tenant_id":"tenant-demo","trust_level":"trusted"}],"step_id":"4a","target_revision":3,"tenant_id":"tenant-demo","trigger":"revision","worker_profile_ref":{"profile_sha256":"cccccccccccccccccccccccccccccccccccccccccccccccccccccccccccccccc","profile_version":"1.0.0","worker_profile_id":"worker-profile-demo"}}
