{"context_package_id":"context-demo-step1","schema_version":"1.0.0","tenant_id":"tenant-demo","project_id":"project-demo","run_id":"run-demo-step1","step_id":"1","logical_session_id":"logical-session-demo-0002","logical_session_revision":2,"trigger":"next_step","target_revision":1,"prompt":{"prompt_id":"heartweb.step.1","prompt_version":"2.2.0","prompt_path":"prompts/1-pillar-identifikation.xml.md","prompt_sha256":"4b0e3a25b150c4342ef6cc0a13bdee69246d10c6563da5ff42f75522bd5c1ef2"},"project_context":{"binding_mode":"project_v2","source_id":"project-v2-demo-0001","revision":1,"logical_ref":"runtime:project/project-v2-demo-0001","content_sha256":"bbbbbbbbbbbbbbbbbbbbbbbbbbbbbbbbbbbbbbbbbbbbbbbbbbbbbbbbbbbbbbbb"},"worker_profile_ref":{"worker_profile_id":"worker-profile-demo","profile_version":"1.0.0","profile_sha256":"cccccccccccccccccccccccccccccccccccccccccccccccccccccccccccccccc"},"output_contracts":[{"contract_id":"https://heartweb.example/schema/outputs/step-1-topic-inventory.schema.json","contract_version":"2.0.0","contract_path":"standards/outputs/step-1-topic-inventory.schema.json","contract_sha256":"3efe1839ecdb511db63410480c58a78daae655206464efbac39bc9d9dbd35ec1"}],"sources":[{"include_order":1,"source_kind":"project_v2","source_id":"project-v2-demo-0001","tenant_id":"tenant-demo","project_id":"project-demo","revision":1,"logical_ref":"runtime:project/project-v2-demo-0001","content_sha256":"bbbbbbbbbbbbbbbbbbbbbbbbbbbbbbbbbbbbbbbbbbbbbbbbbbbbbbbbbbbbbbbb","source_status":"released","trust_level":"trusted"},{"include_order":2,"source_kind":"released_predecessor","source_id":"artifact-step0-demo","tenant_id":"tenant-demo","project_id":"project-demo","revision":1,"logical_ref":"runtime:artifact/artifact-step0-demo","content_sha256":"eeeeeeeeeeeeeeeeeeeeeeeeeeeeeeeeeeeeeeeeeeeeeeeeeeeeeeeeeeeeeeee","source_status":"released","trust_level":"trusted"}],"source_manifest_sha256":"eeeeeeeeeeeeeeeeeeeeeeeeeeeeeeeeeeeeeeeeeeeeeeeeeeeeeeeeeeeeeeee","package_sha256":"ffffffffffffffffffffffffffffffffffffffffffffffffffffffffffffffff","builder_provenance":{"builder_version":"1.0.0","created_at":"2026-08-20T00:00:00Z","created_by":"actor-demo"}}
